{"legal_commands":[{"parameter_domains":{},"kind":"unit_skip","fixed_arguments":{"unit_id":"UNIT_131073"},"runtime_status":"implemented_untested","affected_ids":["UNIT_131073"],"command_id":"CMD_skip_UNIT_131073"},{"parameter_domains":{},"kind":"unit_posture_fortify","fixed_arguments":{"unit_id":"UNIT_131073"},"runtime_status":"implemented_untested","affected_ids":["UNIT_131073"],"command_id":"CMD_fortify_UNIT_131073"},{"parameter_domains":{},"kind":"move_unit","fixed_arguments":{"target_x":51,"unit_id":"UNIT_131073","target_y":29},"runtime_status":"implemented_untested","affected_ids":["UNIT_131073"],"command_id":"CMD_move_UNIT_131073_51_29"},{"parameter_domains":{},"kind":"move_unit","fixed_arguments":{"target_x":52,"unit_id":"UNIT_131073","target_y":28},"runtime_status":"implemented_untested","affected_ids":["UNIT_131073"],"command_id":"CMD_move_UNIT_131073_52_28"},{"parameter_domains":{},"kind":"move_unit","fixed_arguments":{"target_x":51,"unit_id":"UNIT_131073","target_y":27},"runtime_status":"implemented_untested","affected_ids":["UNIT_131073"],"command_id":"CMD_move_UNIT_131073_51_27"},{"parameter_domains":{},"kind":"move_unit","fixed_arguments":{"target_x":50,"unit_id":"UNIT_131073","target_y":27},"runtime_status":"implemented_untested","affected_ids":["UNIT_131073"],"command_id":"CMD_move_UNIT_131073_50_27"},{"parameter_domains":{},"kind":"move_unit","fixed_arguments":{"target_x":50,"unit_id":"UNIT_131073","target_y":28},"runtime_status":"implemented_untested","affected_ids":["UNIT_131073"],"command_id":"CMD_move_UNIT_131073_50_28"},{"parameter_domains":{},"kind":"move_unit","fixed_arguments":{"target_x":50,"unit_id":"UNIT_131073","target_y":29},"runtime_status":"implemented_untested","affected_ids":["UNIT_131073"],"command_id":"CMD_move_UNIT_131073_50_29"},{"parameter_domains":{},"kind":"set_research_tech","fixed_arguments":{"tech_id":"TECH_POTTERY"},"runtime_status":"implemented_untested","affected_ids":{},"command_id":"CMD_research_TECH_POTTERY"},{"parameter_domains":{},"kind":"set_research_tech","fixed_arguments":{"tech_id":"TECH_ANIMAL_HUSBANDRY"},"runtime_status":"implemented_untested","affected_ids":{},"command_id":"CMD_research_TECH_ANIMAL_HUSBANDRY"},{"parameter_domains":{},"kind":"set_research_tech","fixed_arguments":{"tech_id":"TECH_MINING"},"runtime_status":"implemented_untested","affected_ids":{},"command_id":"CMD_research_TECH_MINING"},{"parameter_domains":{},"kind":"set_research_tech","fixed_arguments":{"tech_id":"TECH_SAILING"},"runtime_status":"implemented_untested","affected_ids":{},"command_id":"CMD_research_TECH_SAILING"},{"parameter_domains":{},"kind":"set_research_tech","fixed_arguments":{"tech_id":"TECH_ASTROLOGY"},"runtime_status":"implemented_untested","affected_ids":{},"command_id":"CMD_research_TECH_ASTROLOGY"},{"parameter_domains":{},"kind":"set_research_civic","fixed_arguments":{"civic_id":"CIVIC_CODE_OF_LAWS"},"runtime_status":"implemented_untested","affected_ids":{},"command_id":"CMD_civic_CIVIC_CODE_OF_LAWS"},{"parameter_domains":{},"kind":"queue_production","fixed_arguments":{"build_id":"UNIT_BUILDER","city_id":"CITY_65536"},"runtime_status":"implemented_untested","affected_ids":["CITY_65536"],"command_id":"CMD_prod_UNIT_BUILDER_CITY_65536"},{"parameter_domains":{},"kind":"queue_production","fixed_arguments":{"build_id":"UNIT_SCOUT","city_id":"CITY_65536"},"runtime_status":"implemented_untested","affected_ids":["CITY_65536"],"command_id":"CMD_prod_UNIT_SCOUT_CITY_65536"},{"parameter_domains":{},"kind":"queue_production","fixed_arguments":{"build_id":"UNIT_WARRIOR","city_id":"CITY_65536"},"runtime_status":"implemented_untested","affected_ids":["CITY_65536"],"command_id":"CMD_prod_UNIT_WARRIOR_CITY_65536"},{"parameter_domains":{},"kind":"queue_production","fixed_arguments":{"build_id":"UNIT_SLINGER","city_id":"CITY_65536"},"runtime_status":"implemented_untested","affected_ids":["CITY_65536"],"command_id":"CMD_prod_UNIT_SLINGER_CITY_65536"},{"parameter_domains":{},"kind":"queue_production","fixed_arguments":{"build_id":"BUILDING_MONUMENT","city_id":"CITY_65536"},"runtime_status":"implemented_untested","affected_ids":["CITY_65536"],"command_id":"CMD_prod_BUILDING_MONUMENT_CITY_65536"}],"diplomacy":{"available_proposals":[],"private_inbox":[],"pending_requests":[],"active_deals":[],"relations":[],"legal_trade_inventory":[]},"known_other_cities":[],"decision":{"turn":4,"year":4,"player_id":"PLAYER_1","phase":"strategic_decision","reason":"turn_start"},"known_players":[{"team_id":"TEAM_12","known_civic_ids":{},"population":null,"player_id":"PLAYER_62","known_tech_ids":{},"relation":{"at_war":true,"attitude_value":0,"attitude_id":"ATTITUDE_NEUTRAL","vassal":false,"defensive_pact":false,"open_borders":false,"met":true},"power":null,"leader_name":"Free Cities","land":null,"leader_id":"LEADER_FREE_CITIES","score":0,"known_capital_city_id":null,"known_religion_id":null,"civilization_id":"CIVILIZATION_FREE_CITIES"},{"team_id":"TEAM_13","known_civic_ids":{},"population":null,"player_id":"PLAYER_63","known_tech_ids":{},"relation":{"at_war":true,"attitude_value":0,"attitude_id":"ATTITUDE_NEUTRAL","vassal":false,"defensive_pact":false,"open_borders":false,"met":true},"power":null,"leader_name":"Barbarians","land":null,"score":6,"known_capital_city_id":null,"known_religion_id":null,"civilization_id":"CIVILIZATION_BARBARIAN"}],"advciv":{"recommendations":[],"default_unit_controller":"native","fallback_policy":"Firaxis native AI handles unmoved units after LLM apply."},"history":{"diplomacy_events":[],"accepted_decisions":[],"public_events":[],"command_results":[]},"visible_other_units":[],"your_cities":[{"population":1,"corporations":{},"trade_routes":{},"buildings":{},"commerce":{"research":{"rate":0,"percent":0},"gold":{"rate":0,"percent":0},"espionage":{"rate":0,"percent":0},"culture":{"rate":0,"percent":0}},"plot_id":"PLOT_53_26","specialists":{},"religions":{},"culture":{"maximum":0,"change_per_turn":0,"current":0},"worked_plot_ids":{},"yields":{"food":0,"production":0,"commerce":0},"name":"Canberra","maintenance":0,"defense":{"percent":100,"bombard_damage":0,"health_percent":100},"health":{"negative":0,"positive":0,"net":0},"production_queue":{},"food":{"maximum":0,"change_per_turn":0,"current":0},"happiness":{"negative":0,"positive":0,"net":0},"amenities":{"negative":1,"positive":2,"net":1},"great_people":{"maximum":0,"change_per_turn":0,"current":0},"automation":{"production":true,"citizens":false},"city_id":"CITY_65536","garrison_unit_ids":{},"is_capital":true,"area_id":"AREA_0","occupation_turns":0,"production":{"cost":0,"production_per_turn":8,"item_id":"UNIT_BUILDER","progress":0,"estimated_turns_remaining":4},"is_coastal":false}],"personality":{"identity":"John Curtin","leader_name":"John Curtin","civilization_id":"CIVILIZATION_AUSTRALIA","leader_id":"LEADER_JOHN_CURTIN"},"civ6":{"research_tech":"TECH_POTTERY","map":{"coords_note":"grid x,y; Y increases south","width":60,"height":38,"hex_layout":"odd-r"},"research_civic":{"turns_left":12,"progress":4,"civic_id":"CIVIC_CODE_OF_LAWS"},"session_id":"live-20260925-031644","government_id":"GOVERNMENT_CHIEFDOM","yields":{"culture":1,"favor":0,"faith":1,"science":3}},"your_empire":{"team_id":"TEAM_1","gold":28,"golden_age_turns":0,"gold_per_turn":6,"research":{"cost":25,"tech_id":"TECH_POTTERY","research_per_turn":3,"queue":{},"known_tech_ids":{},"progress":8,"estimated_turns_remaining":6},"anarchy_turns":0,"amenities":{"negative":1,"positive":2,"net":1},"war_weariness":0,"commerce":{"research":{"rate":3,"percent":100},"gold":{"rate":6,"percent":0},"espionage":{"rate":0,"percent":0},"culture":{"rate":1,"percent":0}},"resources":{},"victory_progress":{},"religion":{"convertible_religion_ids":{},"conversion_timer":0,"state_religion_id":null},"score":9,"costs":{"civic_upkeep":0,"inflation":0,"unit_supply":0,"city_maintenance":0,"unit_cost":0},"civics":{},"unit_counts":{"idle":1,"military":1,"total":1,"spies":0,"workers":0,"missionaries":0,"settlers":0,"great_people":0,"upgradeable":0}},"schema_version":"civ6ai-input/1","your_units":[{"health_percent":100,"needs_orders":true,"unit_type_id":"UNIT_WARRIOR","strength":{"maximum":20,"change_per_turn":0,"current":20},"upgrade_options":{},"plot_id":"PLOT_51_28","mission_queue":{},"experience":0,"promotion_ids":{},"health":{"maximum":100,"change_per_turn":0,"current":100},"unit_id":"UNIT_131073","unit_class_id":"FORMATION_CLASS_LAND_COMBAT","movement":{"maximum":2,"change_per_turn":0,"current":2},"can_act":true,"level":1,"cargo_unit_ids":{},"activity_id":"ACTIVITY_UNKNOWN","unit_ai_role":"UNITAI_UNKNOWN","promotion_ready":false,"domain_id":"DOMAIN_LAND"}],"game":{"difficulty_id":"UNKNOWN","game_speed_id":"GAMESPEED_STANDARD","max_turns":null,"climate_id":"CLIMATE_TEMPERATE","map_width":60,"calendar_id":"CALENDAR_DEFAULT","map_height":38,"map_script":"Unknown","options":{},"wrap_x":true,"start_era_id":"ERA_UNKNOWN","era_id":"ERA_ANCIENT","wrap_y":false,"victory_ids":{},"network_multiplayer":false,"sea_level_id":"SEALEVEL_MEDIUM","world_size_id":"MAPSIZE_TINY"},"strategic_summary":{"city_alerts":[],"military_alerts":[{"affected_ids":{},"text":"1 owned units need orders","kind":"ALERT_MILITARY","severity":"warning"}],"resource_alerts":[],"ratios":[{"basis":"military units per owned city","numerator":1,"kind":"MILITARY_PER_CITY","denominator":1},{"basis":"owned units needing orders","numerator":1,"kind":"UNITS_NEEDING_ORDERS","denominator":1}],"economy_alerts":[],"diplomacy_alerts":[]},"known_map":{"explored_percent":2,"areas":{},"format":"plot-grid-v1","visibility_grid":["?????????????????????","?????????????????????","?????????????????????","?????????????????????","?????????????????????","?????????????????????","?????????????????????","?????????????????????","?????????????????????","??????????~~#.???????","??????????....##?????","?????????~..##^#.????","??????????~~..#...???","??????????.^..#.#????","??????????......?????","??????????....???????","???????????...???????","?????????????????????"